{
  "contract_version": "1.0",
  "task_id": "sandbody-example-2",
  "project_id": "panshi-micp-demo",
  "request": "MICP 处理砂体每 m3 碳排多少? 和水泥比谁便宜?",
  "action": "compare",
  "skill_version": "1.0.0",
  "controller_version": "obsidian-ctl-0.1.0",
  "timestamp": "2026-08-07T09:05:00Z",
  "risk_level": "low",
  "human_approval_state": "not_required",
  "constraints": { "analysis_year": 2026, "random_seed": 42 },
  "baseline": { "id": "cement-dsm", "type": "cement", "description": "水泥搅拌桩" },
  "scenarios": [
    {
      "id": "micp-a-standard",
      "type": "micp",
      "materials": { "urea_kg": 40.0, "cacl2_kg": 30.0, "media_kg": 2.0, "culture_kg": 1.0, "water_m3": 0.5 },
      "energy": { "electricity_kwh": 15.0 },
      "transport": { "material_distance_km": 100.0 },
      "waste": { "route": "nitrification", "derive_from_urea": true }
    }
  ]
}
